{
  "version": 1,
  "tour_id": "neo-build-log-001-presenter",
  "title": "Neo Build Log 001 presenter capture",
  "shots": [
    {
      "id": "presenter-circle",
      "title": "Episode 001 presenter overlay",
      "kind": "talking_head",
      "instruction": "Record a clean head-and-shoulders take for the recurring lower-right circular presenter overlay. Look into the lens, keep the background uncluttered, and leave enough margin for a circular crop.",
      "script": "我本地已经有一套 Skills，但 Web ChatGPT 不会自己扫描它们。所以我给它补了一层很小的 bootstrap：先动态发现，再只加载匹配的 Skill。真正有用的是，加载以后它还能通过 MacDevBridge 把任务落到我的 Mac 上。",
      "target_duration_s": 18,
      "camera": "front",
      "orientation": "portrait",
      "lens": "default",
      "framing": {
        "subject": "presenter head and shoulders",
        "guide": "center",
        "position": "center"
      },
      "quality": {
        "face_required": true,
        "warn_if_too_near": true,
        "warn_if_too_far": true,
        "warn_if_dark": true,
        "warn_if_soft": true
      },
      "notes": {
        "episode": "001",
        "usage": "lower-right circular presenter overlay; may be cut into hook, tradeoff, and payoff beats"
      }
    }
  ]
}
